{
  "schema_version": "1",
  "run_id": "002",
  "task_slug": "email-bank-statement",
  "sender": "planning-agent",
  "receiver": "infra-devops-agent",
  "created_at": "2026-03-20T05:12:00Z",
  "status": "completed",
  "retry": true,
  "target_env": "dev",
  "tasks": [
    {
      "task_id": "INFRA-001",
      "type": "update_resource",
      "module_path": "infra/modules/container_app/outputs.tf",
      "description": "Update Container App outputs so health checks can consume a canonical ingress FQDN instead of a pinned revision FQDN. Replace or add outputs that source the public ingress hostname from the Container App resource rather than `latest_revision_fqdn`, and preserve a separate output for active revision when needed. Ensure dev/prod environment outputs remain compatible with downstream consumers and do not expose secrets.",
      "depends_on": []
    },
    {
      "task_id": "INFRA-002",
      "type": "update_pipeline",
      "module_path": "pipelines/tf-infra-apply.yml",
      "description": "Add a deployment verification step that queries the live Container App (`az containerapp show`) to resolve `properties.configuration.ingress.fqdn` and `properties.latestReadyRevisionName`. Use these live values to populate the infra completion handoff deployment metadata instead of stale or persisted revision URLs. Fail fast with a clear diagnostic if the computed probe URL does not align with the active/latest-ready revision.",
      "depends_on": [
        "INFRA-001"
      ]
    },
    {
      "task_id": "INFRA-003",
      "type": "update_pipeline",
      "module_path": ".github/agents/infra-devops.agent.md",
      "description": "Update infra-devops agent execution instructions so completion reports always include canonical ingress FQDN plus `active_revision` obtained from live Azure resource inspection immediately after deployment. Explicitly prohibit reporting stale revision-host URLs (for example `--0000001`) unless they match the current latest ready revision. Keep output format aligned with infra-to-orchestrator schema.",
      "depends_on": [
        "INFRA-002"
      ]
    }
  ],
  "skip_deploy": false,
  "instructions_for_receiver": "You are infra-devops-agent. Validate against agents-communication/schemas/planner-to-infra.schema.json and execute INFRA-001 -> INFRA-002 -> INFRA-003. For health verification, derive probe target from live canonical ingress FQDN and verify revision alignment before calling /health. In v1__infra__to__orchestrator__email-bank-statement__run-002.json, set deployment.fqdn to canonical ingress host and include deployment.active_revision from latestReadyRevisionName."
}